{
  "schema_version": "hdp.raw-lifecycle.v1",
  "record_type": "raw_artifact_lifecycle",
  "artifact_id": "artifact:raw:0123456789abcdef0123456789abcdef",
  "content_sha256": "sha256:0123456789abcdef0123456789abcdef0123456789abcdef0123456789abcdef",
  "byte_length": 2048,
  "retention_class": "warm",
  "reference_count": 0,
  "legal_hold": true,
  "created_at": "2026-08-29T00:00:00Z",
  "grace_until": "2026-09-05T00:00:00Z",
  "expires_at": "2026-09-12T00:00:00Z",
  "state": "active",
  "quarantined_at": null,
  "quarantine_manifest": null,
  "quarantine_object": null,
  "object_retained": false
}
